{
  "artefact_id": "art_001",
  "title": "Project Notes",
  "mime_type": "text/markdown",
  "artefact_type": "file",
  "content_hash": "sha256:2cf24dba5fb0a30e26e83b2ac5b9e29e1b161e5c1fa7425e73043362938b9824",
  "size_bytes": 42,
  "envelope_version": 0,
  "correlation_id": "proj_test_001:run_001:art_001",
  "source": {"system": "hashi-test", "session_id": "proj_test_001", "run_id": "run_001"},
  "created_at": "2026-04-03T10:00:00Z",
  "updated_at": "2026-04-03T10:00:00Z",
  "extra": {}
}
